{
  "$schema": "https://json-schema.org/draft/2020-12/schema",
  "$id": "https://github.com/mycaravam-crypto/gitwizz/blob/main/docs/version-history/gitwizz.version-history.v2.schema.json",
  "title": "gitwizz.version-history/v2",
  "description": "Released SemVer tags and unreleased release branches with the commits each adds, exported by `gitwizz version-history export`. Contract and semantics: docs/version-history/README.md.",
  "type": "object",
  "additionalProperties": false,
  "required": ["schema", "repository", "branchPattern", "shallow", "versions", "warnings"],
  "properties": {
    "schema": { "const": "gitwizz.version-history/v2" },
    "repository": { "type": ["string", "null"], "description": "origin URL without user, password, query or fragment; null without an origin" },
    "branchPattern": { "type": "string", "pattern": "^[^*]+\\*$", "description": "the --branch-pattern used, e.g. release/*" },
    "target": {
      "oneOf": [{ "$ref": "#/$defs/target" }, { "type": "null" }],
      "description": "the --target branch the history is about; null without one. Written by gitwizz since --target; optional for older documents"
    },
    "shallow": { "type": "boolean", "description": "the clone is shallow: commits beyond its boundary are missing" },
    "versions": { "type": "array", "items": { "$ref": "#/$defs/version" }, "description": "unreleased versions first (newest first), then released ones (highest SemVer first)" },
    "warnings": { "type": "array", "items": { "type": "string" } }
  },
  "$defs": {
    "sha": { "type": "string", "pattern": "^[0-9a-f]{40}([0-9a-f]{24})?$" },
    "date": { "type": "string", "pattern": "^\\d{4}-\\d{2}-\\d{2}T\\d{2}:\\d{2}:\\d{2}[+-]\\d{2}:\\d{2}$" },
    "version": {
      "type": "object",
      "additionalProperties": false,
      "required": ["version", "status", "source", "reference", "commitSha", "committedAt", "taggedAt", "bases", "changes", "truncated", "warnings"],
      "properties": {
        "version": { "type": "string", "minLength": 1, "description": "tag name without a leading v, or the branch name after the prefix" },
        "status": { "enum": ["released", "unreleased"] },
        "source": { "enum": ["tag", "branch", "remote-branch", "target"] },
        "reference": { "type": "string", "minLength": 1, "description": "the full ref (refs/tags/..., refs/heads/..., refs/remotes/...), or a --target given as another ref or commit" },
        "commitSha": { "$ref": "#/$defs/sha" },
        "committedAt": { "$ref": "#/$defs/date" },
        "taggedAt": { "oneOf": [{ "$ref": "#/$defs/date" }, { "type": "null" }], "description": "tagger date of an annotated tag; null for lightweight tags and branches" },
        "bases": { "type": "array", "items": { "$ref": "#/$defs/base" }, "description": "the releases this version builds on, highest first; empty for the first release" },
        "changes": { "type": "array", "items": { "$ref": "#/$defs/change" }, "description": "commits none of the bases contain, newest first in topological order" },
        "truncated": { "type": "boolean", "description": "more commits than --limit: changes is incomplete" },
        "warnings": { "type": "array", "items": { "type": "string" } },
        "pullRequests": {
          "type": "array", "items": { "$ref": "#/$defs/pullRequest" },
          "description": "the pull requests completed in this version, newest first. Written by gitwizz since pull request grouping; optional for older documents"
        }
      }
    },
    "pullRequest": {
      "type": "object",
      "additionalProperties": false,
      "required": ["id", "title", "strategy", "mergeCommit", "committedAt", "category", "type", "scope", "description", "breaking", "commits"],
      "properties": {
        "id": { "type": "string", "pattern": "^#\\d+$", "description": "#12" },
        "title": { "type": "string", "description": "the pull request's title as the merge or squash commit carries it" },
        "strategy": { "enum": ["merge", "squash"] },
        "mergeCommit": { "$ref": "#/$defs/sha" },
        "committedAt": { "$ref": "#/$defs/date" },
        "category": { "enum": ["feature", "fix", "performance", "other"], "description": "from the title's type, else the most significant category of its commits" },
        "type": { "type": ["string", "null"], "description": "the title's Conventional Commits type, lower case; null when the title isn't one" },
        "scope": { "type": ["string", "null"] },
        "description": { "type": "string", "description": "the title after type(scope)!:, or the whole title" },
        "breaking": { "type": "boolean", "description": "the title or any of its commits is breaking" },
        "commits": { "type": "array", "items": { "$ref": "#/$defs/sha" }, "description": "its merge or squash commit and the commits the merge brought in, newest first" }
      }
    },
    "target": {
      "type": "object",
      "additionalProperties": false,
      "required": ["name", "reference", "sha"],
      "properties": {
        "name": { "type": "string", "minLength": 1, "description": "as given: main" },
        "reference": { "type": "string", "minLength": 1, "description": "refs/heads/main, refs/remotes/origin/main when there is no local branch, else the ref as given" },
        "sha": { "$ref": "#/$defs/sha" }
      }
    },
    "base": {
      "type": "object",
      "additionalProperties": false,
      "required": ["version", "reference", "sha"],
      "properties": {
        "version": { "type": "string", "minLength": 1 },
        "reference": { "type": "string", "pattern": "^refs/tags/.+$" },
        "sha": { "$ref": "#/$defs/sha" }
      }
    },
    "change": {
      "type": "object",
      "additionalProperties": false,
      "required": ["sha", "subject", "committedAt", "kind", "category", "type", "scope", "description", "breaking"],
      "properties": {
        "sha": { "$ref": "#/$defs/sha" },
        "subject": { "type": "string", "description": "the first line of the commit message" },
        "committedAt": { "$ref": "#/$defs/date" },
        "kind": { "enum": ["commit", "merge"] },
        "category": { "enum": ["feature", "fix", "performance", "other", "merge"] },
        "type": { "type": ["string", "null"], "description": "Conventional Commits type, lower case; null when the subject isn't one" },
        "scope": { "type": ["string", "null"] },
        "description": { "type": "string", "description": "the subject after type(scope)!:, or the whole subject" },
        "breaking": { "type": "boolean", "description": "! before the colon or a BREAKING CHANGE footer" },
        "pullRequest": { "type": ["string", "null"], "pattern": "^#\\d+$", "description": "the pull request it came with (#12); null without one. Optional for older documents" }
      }
    }
  }
}
